{
  "schemaVersion": 1,
  "agent": "cursor",
  "version": "current",
  "source": {
    "kind": "current-official-docs",
    "url": "https://cursor.com/docs/cli/reference/slash-commands.md",
    "revision": null,
    "sha256": "a39f8c0086b6ca6e2bfde6c3595142987cdef4489ad0c0e213510bb746947111"
  },
  "commands": [
    {
      "name": "/about",
      "description": "Show CLI version, system, and account info. Also copies it to the clipboard.",
      "aliases": [],
      "argsHint": null,
      "category": "Built-in",
      "availability": "unknown"
    },
    {
      "name": "/ask",
      "description": "Toggle Ask mode for read-only questions",
      "aliases": [],
      "argsHint": null,
      "category": "Built-in",
      "availability": "unknown"
    },
    {
      "name": "/bedrock",
      "description": "Configure Bedrock when the Bedrock feature is enabled",
      "aliases": [],
      "argsHint": "[subcommand]",
      "category": "Built-in",
      "availability": "unknown"
    },
    {
      "name": "/clear",
      "description": "Start a new chat session. /new, /new-chat, and /newchat are aliases.",
      "aliases": [],
      "argsHint": null,
      "category": "Built-in",
      "availability": "unknown"
    },
    {
      "name": "/config",
      "description": "Configure CLI settings interactively",
      "aliases": [],
      "argsHint": null,
      "category": "Built-in",
      "availability": "unknown"
    },
    {
      "name": "/copy",
      "description": "Copy a previous user message to the clipboard",
      "aliases": [],
      "argsHint": null,
      "category": "Built-in",
      "availability": "unknown"
    },
    {
      "name": "/copy-conversation-id",
      "description": "Copy the current conversation ID to the clipboard",
      "aliases": [],
      "argsHint": null,
      "category": "Built-in",
      "availability": "unknown"
    },
    {
      "name": "/copy-request-id",
      "description": "Copy the last request ID to the clipboard",
      "aliases": [],
      "argsHint": null,
      "category": "Built-in",
      "availability": "unknown"
    },
    {
      "name": "/debug",
      "description": "Toggle Debug mode or submit a prompt in Debug mode",
      "aliases": [],
      "argsHint": "[prompt]",
      "category": "Built-in",
      "availability": "unknown"
    },
    {
      "name": "/exit",
      "description": "Exit",
      "aliases": [],
      "argsHint": null,
      "category": "Built-in",
      "availability": "unknown"
    },
    {
      "name": "/feedback",
      "description": "Share feedback with the team",
      "aliases": [],
      "argsHint": "<message>",
      "category": "Built-in",
      "availability": "unknown"
    },
    {
      "name": "/fork",
      "description": "Fork the current chat into a new session",
      "aliases": [],
      "argsHint": null,
      "category": "Built-in",
      "availability": "unknown"
    },
    {
      "name": "/goal",
      "description": "Give the agent a long-lived objective to work towards until it's fully complete. Rolling out.",
      "aliases": [],
      "argsHint": "[objective]",
      "category": "Built-in",
      "availability": "conditional"
    },
    {
      "name": "/help",
      "description": "Show help. Use /help for command details.",
      "aliases": [],
      "argsHint": "[command]",
      "category": "Built-in",
      "availability": "unknown"
    },
    {
      "name": "/line-numbers",
      "description": "Toggle line numbers in code blocks",
      "aliases": [],
      "argsHint": null,
      "category": "Built-in",
      "availability": "unknown"
    },
    {
      "name": "/logout",
      "description": "Sign out from Cursor",
      "aliases": [],
      "argsHint": null,
      "category": "Built-in",
      "availability": "unknown"
    },
    {
      "name": "/logs",
      "description": "Show the debug log path and copy it to the clipboard",
      "aliases": [],
      "argsHint": null,
      "category": "Built-in",
      "availability": "unknown"
    },
    {
      "name": "/max-mode",
      "description": "Toggle Max Mode on legacy request-based plans",
      "aliases": [],
      "argsHint": null,
      "category": "Built-in",
      "availability": "unknown"
    },
    {
      "name": "/mcp",
      "description": "Manage MCP servers and list tools for a server",
      "aliases": [],
      "argsHint": "[list|list-tools] [identifier]",
      "category": "Built-in",
      "availability": "unknown"
    },
    {
      "name": "/model",
      "description": "Select a model. Press Tab to edit.",
      "aliases": [],
      "argsHint": "[filter]",
      "category": "Built-in",
      "availability": "unknown"
    },
    {
      "name": "/open",
      "description": "Open the repository's Git root in Cursor. /cursor is an alias.",
      "aliases": [],
      "argsHint": null,
      "category": "Built-in",
      "availability": "unknown"
    },
    {
      "name": "/plan",
      "description": "Switch to Plan mode, show the current plan, or submit a prompt in Plan mode",
      "aliases": [],
      "argsHint": "[prompt]",
      "category": "Built-in",
      "availability": "unknown"
    },
    {
      "name": "/plugin",
      "description": "Manage plugins and marketplaces",
      "aliases": [],
      "argsHint": "[subcommand]",
      "category": "Built-in",
      "availability": "unknown"
    },
    {
      "name": "/quit",
      "description": "Exit",
      "aliases": [],
      "argsHint": null,
      "category": "Built-in",
      "availability": "unknown"
    },
    {
      "name": "/rename",
      "description": "Rename the current chat session",
      "aliases": [],
      "argsHint": "<name>",
      "category": "Built-in",
      "availability": "unknown"
    },
    {
      "name": "/resume",
      "description": "Open recent chats and resume one",
      "aliases": [],
      "argsHint": null,
      "category": "Built-in",
      "availability": "unknown"
    },
    {
      "name": "/rewind",
      "description": "Jump back to a previous message",
      "aliases": [],
      "argsHint": null,
      "category": "Built-in",
      "availability": "unknown"
    },
    {
      "name": "/run-everything",
      "description": "Toggle Run Everything or show its status. /auto-run is an alias.",
      "aliases": [],
      "argsHint": "[on|off|status]",
      "category": "Built-in",
      "availability": "unknown"
    },
    {
      "name": "/sandbox",
      "description": "Configure sandbox mode and network access settings",
      "aliases": [],
      "argsHint": null,
      "category": "Built-in",
      "availability": "unknown"
    },
    {
      "name": "/setup-terminal",
      "description": "Configure terminal newline keybindings. See Terminal setup.",
      "aliases": [],
      "argsHint": null,
      "category": "Built-in",
      "availability": "unknown"
    },
    {
      "name": "/shell",
      "description": "Enter Shell Mode. /sh and /run are aliases.",
      "aliases": [],
      "argsHint": "[command]",
      "category": "Built-in",
      "availability": "unknown"
    },
    {
      "name": "/show-thinking",
      "description": "Toggle thinking block display",
      "aliases": [],
      "argsHint": null,
      "category": "Built-in",
      "availability": "unknown"
    },
    {
      "name": "/status-indicators",
      "description": "Toggle terminal title status indicators",
      "aliases": [],
      "argsHint": null,
      "category": "Built-in",
      "availability": "unknown"
    },
    {
      "name": "/summarize",
      "description": "Summarize the conversation to reduce context. /compress is an alias.",
      "aliases": [],
      "argsHint": null,
      "category": "Built-in",
      "availability": "unknown"
    },
    {
      "name": "/update",
      "description": "Update Cursor Agent to the latest version",
      "aliases": [],
      "argsHint": null,
      "category": "Built-in",
      "availability": "unknown"
    },
    {
      "name": "/vim",
      "description": "Toggle Vim keys",
      "aliases": [],
      "argsHint": null,
      "category": "Built-in",
      "availability": "unknown"
    }
  ]
}
